{
 "generated_utc": "2026-10-11T12:46:28Z",
 "wake_days": 14,
 "safes": 40,
 "read": 40,
 "woke": [],
 "changes": [
  {
   "delta": 1,
   "idle_days": 0.6,
   "woke": false,
   "safe": "robinhood:0x20d6\u2026be1a",
   "governs": [
    "robinhood:0x83341f891f898cb5e0cacc8a70501bba83d9cecf",
    "robinhood:0xa203a21dccb461e415daa342e8e635b6cee0ccb3"
   ],
   "previous_run": "2026-10-11T06:47:22Z"
  }
 ],
 "never_executed": [
  "robinhood:0x0605\u20269728",
  "tempo:0x6458\u2026fbbc"
 ],
 "stale": 0,
 "unread_chains": [],
 "by_safe": {
  "arbitrum:569110bd097c8358": {
   "nonce": 102,
   "observed_since": "2026-10-10T21:12:49Z",
   "idle_since": "2026-10-10T21:12:49Z",
   "governs": [
    "arbitrum:0xffa10065ce1d1c42fabc46e06b84ed8ffeb4bae5"
   ],
   "safe": "arbitrum:0x5f0b\u2026841f",
   "never_executed": false
  },
  "arbitrum:aef74c6ad6c7951d": {
   "nonce": 162,
   "observed_since": "2026-10-10T21:12:49Z",
   "idle_since": "2026-10-10T21:12:49Z",
   "governs": [
    "arbitrum:0x888888888889758f76e7103c6cbf23abbf58f946"
   ],
   "safe": "arbitrum:0x7877\u202675ac",
   "never_executed": false
  },
  "arbitrum:3329250c80379faf": {
   "nonce": 251,
   "observed_since": "2026-10-10T21:12:49Z",
   "idle_since": "2026-10-10T21:12:49Z",
   "governs": [
    "arbitrum:0x1a3c9b1d2f0529d97f2afc5136cc23e58f1fd35b"
   ],
   "safe": "arbitrum:0xba6a\u2026155d",
   "never_executed": false
  },
  "base:31e3ad0247904d1a": {
   "nonce": 98,
   "observed_since": "2026-10-10T21:12:49Z",
   "idle_since": "2026-10-10T21:12:49Z",
   "governs": [
    "base:0xbeef010f9cb27031ad51e3333f9af9c6b1228183",
    "base:0xbeef2d50b428675a1921bc6bbf4bfb9d8cf1461a"
   ],
   "safe": "base:0x0a0e\u2026f8dd",
   "never_executed": false
  },
  "base:e57564b343dde663": {
   "nonce": 6,
   "observed_since": "2026-10-10T21:12:49Z",
   "idle_since": "2026-10-10T21:12:49Z",
   "governs": [
    "base:0xfbb21d0380bee3312b33c4353c8936a0f13ef26c"
   ],
   "safe": "base:0x4463\u2026779e",
   "never_executed": false
  },
  "base:2c43f2ff42438f1e": {
   "nonce": 157,
   "observed_since": "2026-10-10T21:12:49Z",
   "idle_since": "2026-10-10T21:12:49Z",
   "governs": [
    "base:0xee8f4ec5672f09119b96ab6fb59c27e1b7e44b61"
   ],
   "safe": "base:0x5a4e\u2026d4d0",
   "never_executed": false
  },
  "base:18c0d155cf0f0269": {
   "nonce": 16,
   "observed_since": "2026-10-10T21:12:49Z",
   "idle_since": "2026-10-10T21:12:49Z",
   "governs": [
    "base:0xbbbbbbbbbb9cc5e90e3b3af64bdaf62c37eeffcb"
   ],
   "safe": "base:0xcba2\u20269afa",
   "never_executed": false
  },
  "base:813d4f2afbe04aad": {
   "nonce": 2725,
   "observed_since": "2026-10-10T21:12:49Z",
   "idle_since": "2026-10-10T21:12:49Z",
   "governs": [
    "base:0x5e7bb104d84c7cb9b682aac2f3d509f5f406809a"
   ],
   "safe": "base:0xe6a4\u20262075",
   "never_executed": false
  },
  "ethereum-l1:31e3ad0247904d1a": {
   "nonce": 139,
   "observed_since": "2026-10-10T21:12:49Z",
   "idle_since": "2026-10-10T21:12:49Z",
   "governs": [
    "ethereum-l1:0xbeef01735c132ada46aa9aa4c54623caa92a64cb",
    "ethereum-l1:0xbeef047a543e45807105e51a8bbefcc5950fcfba",
    "ethereum-l1:0xbeef088055857739c12cd3765f20b7679def0f51",
    "ethereum-l1:0xbeef0c075da5d01112ae5cf34d257074fb5ddb2f"
   ],
   "safe": "ethereum-l1:0x0a0e\u2026f8dd",
   "never_executed": false
  },
  "ethereum-l1:65143c790d4a5772": {
   "nonce": 32,
   "observed_since": "2026-10-10T21:12:49Z",
   "idle_since": "2026-10-10T21:12:49Z",
   "governs": [
    "ethereum-l1:0x858646372cc42e1a627fce94aa7a7033e7cf075a"
   ],
   "safe": "ethereum-l1:0x369e\u20269111",
   "never_executed": false
  },
  "ethereum-l1:9f957a8d13d777f4": {
   "nonce": 742,
   "observed_since": "2026-10-10T21:12:49Z",
   "idle_since": "2026-10-10T21:12:49Z",
   "governs": [
    "ethereum-l1:0x2cc440b721d2cafd6d64908d6d8c4acc57f8afc3"
   ],
   "safe": "ethereum-l1:0x3b0a\u20261862",
   "never_executed": false
  },
  "ethereum-l1:18c0d155cf0f0269": {
   "nonce": 282,
   "observed_since": "2026-10-10T21:12:49Z",
   "idle_since": "2026-10-10T21:12:49Z",
   "governs": [
    "ethereum-l1:0xbbbbbbbbbb9cc5e90e3b3af64bdaf62c37eeffcb"
   ],
   "safe": "ethereum-l1:0xcba2\u20269afa",
   "never_executed": false
  },
  "ethereum-l1:701af90d53a786de": {
   "nonce": 2180,
   "observed_since": "2026-10-11T06:47:22Z",
   "idle_since": "2026-10-11T06:47:22Z",
   "governs": [
    "ethereum-l1:0xc5f0f7b66764f6ec8c8dff7ba683102295e16409"
   ],
   "safe": "ethereum-l1:0xfa77\u20266a66",
   "never_executed": false
  },
  "hyperliquid:982ff508c289b3fd": {
   "nonce": 68,
   "observed_since": "2026-10-10T21:12:49Z",
   "idle_since": "2026-10-10T21:12:49Z",
   "governs": [
    "hyperliquid:0x393d0b87ed38fc779fd9611144ae649ba6082109",
    "hyperliquid:0x71f0019cc7fa79e4f42587fb7b9a817d8d2429ec"
   ],
   "safe": "hyperliquid:0x18a8\u2026f8f1",
   "never_executed": false
  },
  "monad:31e3ad0247904d1a": {
   "nonce": 15,
   "observed_since": "2026-10-10T21:12:49Z",
   "idle_since": "2026-10-10T21:12:49Z",
   "governs": [
    "monad:0x32841a8511d5c2c5b253f45668780b99139e476d"
   ],
   "safe": "monad:0x0a0e\u2026f8dd",
   "never_executed": false
  },
  "monad:d104c354d63359d9": {
   "nonce": 70,
   "observed_since": "2026-10-10T21:12:49Z",
   "idle_since": "2026-10-10T21:12:49Z",
   "governs": [
    "monad:0xd651346d7c789536ebf06dc72ae3c8502cd695cc"
   ],
   "safe": "monad:0x8b73\u2026788b",
   "never_executed": false
  },
  "plasma:aef74c6ad6c7951d": {
   "nonce": 27,
   "observed_since": "2026-10-10T21:12:49Z",
   "idle_since": "2026-10-10T21:12:49Z",
   "governs": [
    "plasma:0x888888888889758f76e7103c6cbf23abbf58f946"
   ],
   "safe": "plasma:0x7877\u202675ac",
   "never_executed": false
  },
  "plasma:c7131410f9e5e16b": {
   "nonce": 186,
   "observed_since": "2026-10-10T21:12:49Z",
   "idle_since": "2026-10-10T21:12:49Z",
   "governs": [
    "plasma:0xa9c251f8304b1b3fc2b9e8fcae78d94eff82ac66"
   ],
   "safe": "plasma:0x7d07\u2026dcd8",
   "never_executed": false
  },
  "plasma:0643a66314f381e3": {
   "nonce": 1,
   "observed_since": "2026-10-10T21:12:49Z",
   "idle_since": "2026-10-10T21:12:49Z",
   "governs": [
    "plasma:0x6c50b8ca8eeaa1c75dee5b5ea79772acabc92f48"
   ],
   "safe": "plasma:0xca6f\u20268f53",
   "never_executed": false
  },
  "robinhood:fff95d40b62c2d93": {
   "nonce": 0,
   "observed_since": "2026-10-10T21:12:49Z",
   "idle_since": "2026-10-10T21:12:49Z",
   "governs": [
    "robinhood:0x9d53d5e3bd5e8d4cbfa6db1ca238aea02e651010"
   ],
   "safe": "robinhood:0x0605\u20269728",
   "never_executed": true
  },
  "robinhood:d07a2565930ac3de": {
   "nonce": 8,
   "observed_since": "2026-10-10T21:12:49Z",
   "idle_since": "2026-10-10T21:12:49Z",
   "governs": [
    "robinhood:0x292fc50e4eb66c3f6514b9e402dbc25961824d62"
   ],
   "safe": "robinhood:0x0605\u2026f53d",
   "never_executed": false
  },
  "robinhood:e8bf689e4f96ba54": {
   "nonce": 405,
   "observed_since": "2026-10-10T21:12:49Z",
   "idle_since": "2026-10-10T22:48:04Z",
   "last_moved": "2026-10-10T22:48:04Z",
   "governs": [
    "robinhood:0x1ac9db4a2608ba45d6127b1737949b51bb54b7f3"
   ],
   "safe": "robinhood:0x0eea\u2026dfd8",
   "never_executed": false
  },
  "robinhood:3cb8c359ff7f85fd": {
   "nonce": 519,
   "observed_since": "2026-10-10T21:12:49Z",
   "idle_since": "2026-10-11T12:46:28Z",
   "last_moved": "2026-10-11T12:46:28Z",
   "governs": [
    "robinhood:0x83341f891f898cb5e0cacc8a70501bba83d9cecf",
    "robinhood:0xa203a21dccb461e415daa342e8e635b6cee0ccb3"
   ],
   "safe": "robinhood:0x20d6\u2026be1a",
   "never_executed": false
  },
  "robinhood:34c1abf46babb77e": {
   "nonce": 150,
   "observed_since": "2026-10-10T21:12:49Z",
   "idle_since": "2026-10-10T21:12:49Z",
   "governs": [
    "robinhood:0x16494a80e08bcb9285d87b67149d7b01774d82f8"
   ],
   "safe": "robinhood:0x2a04\u20262b0e",
   "never_executed": false
  },
  "robinhood:e783f5ca68909703": {
   "nonce": 8,
   "observed_since": "2026-10-10T21:12:49Z",
   "idle_since": "2026-10-10T21:12:49Z",
   "governs": [
    "robinhood:0x128a800cbc615cc110bff16e475865c67631603a",
    "robinhood:0xf28704c691290547924e2129d407da36bda8ce0f"
   ],
   "safe": "robinhood:0x31c4\u20269693",
   "never_executed": false
  },
  "robinhood:b1dd799978f41d69": {
   "nonce": 2,
   "observed_since": "2026-10-10T21:12:49Z",
   "idle_since": "2026-10-10T21:12:49Z",
   "governs": [
    "robinhood:0x026df18fbd2a7639089d0a16293383ec687a5ca1",
    "robinhood:0x65dc90cd3a0bcde967c8ae6019d6790b616e78f7",
    "robinhood:0xe129d4cb2d454c4acfac909d1576453a9b835f61"
   ],
   "safe": "robinhood:0x396a\u20263ed4",
   "never_executed": false
  },
  "robinhood:5e41f828c627cbe2": {
   "nonce": 381,
   "observed_since": "2026-10-10T21:12:49Z",
   "idle_since": "2026-10-10T21:12:49Z",
   "governs": [
    "robinhood:0x99347d5f70d3838763f6bddcf80304c8aa953b57"
   ],
   "safe": "robinhood:0x3bb7\u20265f42",
   "never_executed": false
  },
  "robinhood:247592577c4194ab": {
   "nonce": 13,
   "observed_since": "2026-10-10T21:12:49Z",
   "idle_since": "2026-10-10T21:12:49Z",
   "governs": [
    "robinhood:0xe51960f1b45f1c9fb6d166e6a884f866fc70433b"
   ],
   "safe": "robinhood:0x6fa4\u20264657",
   "never_executed": false
  },
  "robinhood:aef74c6ad6c7951d": {
   "nonce": 3,
   "observed_since": "2026-10-10T21:12:49Z",
   "idle_since": "2026-10-10T21:12:49Z",
   "governs": [
    "robinhood:0x544bf81c855ae84c1e8b65d5e38770898d01eee2"
   ],
   "safe": "robinhood:0x7877\u202675ac",
   "never_executed": false
  },
  "robinhood:7a113b1bf8b8d018": {
   "nonce": 12,
   "observed_since": "2026-10-10T21:12:49Z",
   "idle_since": "2026-10-10T21:12:49Z",
   "governs": [
    "robinhood:0x4472c69d299382f8847ebce4fc6ed8e295510e3e",
    "robinhood:0x925f92f055edb79c42b5d45e64a1b74143b90ea0",
    "robinhood:0x9c3663fa9ab976e67b42939486ec4966cb41a0bb"
   ],
   "safe": "robinhood:0x81b8\u202641bd",
   "never_executed": false
  },
  "robinhood:3d6d6b8cfdd450db": {
   "nonce": 3,
   "observed_since": "2026-10-10T21:12:49Z",